date,cleaned_title,compound,neg,neu,pos
2024-05-02,Chip Stocks on Sale 3 Semiconductor Plays to Buy the Dip,0.19846605,0.029130762,0.7432724,0.2275968
2024-05-02,3 Penny Stocks to Buy Now to Turn 1K Into 133K by 2026,0.42119932,0.013257564,0.55228555,0.43445688
2024-05-02,7 DRated Tech Stocks to Dump Now,-0.7796897,0.8056069,0.16847597,0.025917167
2024-05-02,Qualcomm is benefiting as the Chinese Android market returns to growth,0.935534,0.010284887,0.04389622,0.9458189
2024-05-02,4 stocks to watch on Thursday NVO AAPL and more,0.051530674,0.022319673,0.90383,0.07385035
2024-05-02,Qorvo sinks after outlook for June quarter falls short on weaker mobile demand,-0.9414445,0.96366596,0.014112574,0.022221476
2024-05-02,3 Stocks Gunning for TrillionDollar Status The Players to Own Now,0.025147587,0.034868713,0.90511507,0.0600163
2024-05-02,Apple Com hosts conference call for investors,-0.002394542,0.028712474,0.94496965,0.026317932
2024-05-02,3 5G Technology Stocks With the Potential to Make You an Overnight Millionaire,0.24206345,0.010545326,0.7368459,0.25260878
2024-05-02,Wall Street Inches Up After Powells Inflation Remarks Chipmakers Rebound Gold Crude Falter Whats Driving Markets Thursday,-0.63325095,0.78715545,0.05894007,0.15390451
2024-05-02,Apple GAAP EPS of 153 beats by 003 revenue of 908B beats by 190M,0.0967677,0.01895246,0.86532736,0.11572016
2024-05-02,Apple raises dividend by 42 to 025 authorizes stock buyback of up to 110B,0.46035692,0.02608338,0.48747623,0.4864403
2024-05-02,Apple Q2 results top expectations despite iPhone fears unveils 110B buyback,0.9035272,0.027284104,0.041904677,0.9308113
2024-05-02,Apple Inc Q2 Profit beats estimates,0.35965294,0.29393595,0.05247511,0.6535889
2024-05-03,AAPL Stock Earnings Apple Beats EPS Beats Revenue for Q2 2024,0.3723724,0.082529604,0.46256843,0.454902
2024-05-03,Buy Rating Affirmed Apples Strong Financials and Growth Catalysts Signal Promising Future,0.93099904,0.019759795,0.029481307,0.9507588
2024-05-03,Will Apple Beat on Q2 Earnings Amid iPhone Slump ETFs in Focus,-0.3605194,0.55028087,0.25995767,0.18976146
2024-05-03,Analysts Offer Insights on Technology Companies Cloudflare NET and Apple AAPL,0.03434927,0.018591803,0.92846715,0.052941073
2024-05-03,Analysts Offer Insights on Technology Companies Grab GRAB Cognex CGNX and Apple AAPL,0.0715449,0.01418856,0.900078,0.08573346
2024-05-03,Analysts Offer Insights on Technology Companies Apple AAPL and Cognex CGNX,0.049291283,0.014385893,0.9219369,0.06367718
2024-05-03,Apple AAPL Receives a Hold from KeyBanc,0.14140023,0.010196524,0.83820665,0.15159675
2024-05-03,Apples Strong Financials and Strategic Outlook Merit a Buy Rating,0.929714,0.010934231,0.048417535,0.94064826
2024-05-03,Apples Steady Performance Amidst Innovation Challenges and Growth Prospects,0.9073907,0.011227561,0.07015419,0.91861826
2024-05-03,Outperform Rating Reaffirmed for Apple Amid Strong Services Growth and Positive Forward Guidance,0.9251222,0.026407585,0.022062581,0.9515298
2024-05-03,Maintaining Hold Balancing Apples Mixed Financial Results with Cautious Market Outlook,-0.8677986,0.917082,0.033634614,0.04928337
2024-05-03,Buy Rating Affirmed for Apple Amid Strong Q2 Performance and Growth Prospects,0.9269003,0.022942338,0.02721499,0.9498427
2024-05-03,Apples Strong Market Position and Growth Potential Secure Buy Rating and 216 Price Target,0.39010438,0.007758165,0.5943793,0.39786255
2024-05-03,Apples Resilient Growth and Strategic AI Expansion Bolster Buy Rating Amid Economic Challenges,0.93348,0.013527383,0.039465163,0.9470074
2024-05-03,Buy Rating on Apple Affirmed Amid Solid Performance and Growth Prospects,0.92707914,0.023672825,0.025575314,0.95075196
2024-05-03,Apples Resilience in China and Services Growth Fuel Positive Investment Outlook,0.9261255,0.014643435,0.044587597,0.94076896
2024-05-03,Apple Holds Steady Balancing Solid Financials with Greater China Concerns and Future Tech Potential,0.9329783,0.019603284,0.027815074,0.9525816
2024-05-03,Apple Stocks Rotten Spot Why the Tech Giant Is Losing Its Shine in 2024,-0.89999145,0.9232725,0.053446557,0.02328101
2024-05-03,Buy Rating Affirmed for Apple Amidst Strong iPhone Sales in China and Robust Services Growth,0.93255293,0.020991901,0.025463145,0.95354486
2024-05-03,Stock Market Crash Warning Dont Get Caught Holding These 3 Dow Stocks,-0.15592547,0.18286988,0.7901857,0.026944416
2024-05-03,Stock Market Crash Warning Dont Get Caught Holding These 3 Meme Stocks,-0.17527887,0.200474,0.7743309,0.025195114
2024-05-03,Apple Stocks 124 Upside Potential The AIDriven Growth Story You Need to Know,0.023828696,0.030870534,0.9144302,0.05469923
2024-05-03,Analysts Conflicted on These Technology Names Fortinet FTNT Five9 FIVN and Apple AAPL,-0.32145044,0.35999975,0.601451,0.038549297
2024-05-03,The worst is behind Apples iPhone demand may be improving with AI hopes near,0.93382454,0.018694855,0.02878578,0.9525194
2024-05-03,Apples Resilience and Growth Prospects Justify a Buy Rating Amidst Market Challenges,0.75046724,0.010233982,0.22906478,0.76070124
2024-05-03,Apples historic buyback ripples through the market,0.031450287,0.10252398,0.7635018,0.13397427
2024-05-03,Analysts Offer Insights on Technology Companies Asure ASUR and Apple AAPL,0.05403415,0.014146282,0.91767323,0.068180434
2024-05-03,Biggest stock movers today WOW AAPL SQ and more,0.14017263,0.016221233,0.8273849,0.15639387
2024-05-03,Warren Buffetts Berkshire Hathaway Faces Apple Risk Bearish Momentum Ahead Of Q1 Earnings,-0.2100802,0.5701267,0.06982679,0.3600465
2024-05-03,AAPL Shares Pop on 110 Billion Apple Stock Buyback Plans,0.4819329,0.04627518,0.42551672,0.5282081
2024-05-03,Apple Delivered Much BetterThanFeared JalenBrunsonLike Quarter Says Bullish Analyst Why Betting Against Cupertino Is A Wrong Move,-0.69290817,0.7836071,0.1256939,0.09069898
2024-05-03,Why Is WideOpenWest WOW Stock Up 30 Today,0.16104557,0.035680752,0.76759297,0.19672632
2024-05-03,DJT Stock Alert SEC Charges Trump Media Auditor With Massive Fraud,-0.84920144,0.86274743,0.12370662,0.01354596
2024-05-03,Why Are Stocks Up Today,-0.14328621,0.23660219,0.67008185,0.093315974
2024-05-03,Analysts Offer Insights on Technology Companies Ansys ANSS and Apple AAPL,0.03524287,0.017711638,0.92933387,0.05295451
2024-05-03,April Jobs Data Tees Stocks Up for a Strong Summer Rally,0.81225353,0.058194317,0.07135789,0.8704479
2024-05-03,Dear Berkshire Hathaway Stock Fans Mark Your Calendars for May 4,-0.008661047,0.034897424,0.9388662,0.026236378
2024-05-03,Catalyst Watch Disney earnings Apple iPad event and Fed speakers back on the circuit,0.04784251,0.021405168,0.9093471,0.06924768
2024-05-03,7 Apple Analysts Size Up Q2 Results Artificial Intelligence A Major Upgrade Cycle Within Product Categories Such As The iPhone,0.8346226,0.035215363,0.094946586,0.869838
2024-05-03,Apple Eyes Best Session Since Late 2022 Breaks Above 200Day Average For First Time In 4 Months,0.70470166,0.07632044,0.14265746,0.7810221
2024-05-03,Apple To Fix IPhone Alarm Issue,-0.27039498,0.33928317,0.59182864,0.0688882
2024-05-03,Federal Reserve Dismisses Rate Hike Fears Labor Market Cools Apple Lures Investors With RecordBreaking Buyback This Week In The Market,0.48181924,0.147612,0.22295678,0.62943125
2024-05-03,Summary Notice of Pendency and Proposed Settlement of Shareholder Derivative Actions,-0.12321438,0.1429692,0.8372759,0.01975483
2024-05-04,AI Revolution Now Coming To Cupertino Tech Bull Says Betting Against Apples Tim Cook Has Been Proven Wrong Again And Again,-0.6020859,0.66680527,0.2684753,0.06471939
2024-05-04,Apple Maintains Hold Rating Amid Mixed Performance and Cautious Outlook,-0.86158854,0.9222008,0.017186893,0.060612265
2024-05-04,Berkshire Hathaway Q1 operating earnings gain 39 YY cash hits record 189B,0.79392076,0.08587273,0.034333747,0.87979347
2024-05-04,Warren Buffett sees Berkshire operating earnings up modestly this year annual meeting,0.931729,0.020309871,0.02765125,0.9520389
2024-05-04,Buffett says Apple likely to be largest investment at 2024end despite Q1 stake cut update,0.42643264,0.035221074,0.50312525,0.4616537
2024-05-05,19 out of 21 information technology stocks deliver EPS wins this week Earnings Scorecard,0.7609968,0.029981997,0.17903917,0.7909788
2024-05-05,About 79 of the SP 500 names beat on EPS during the busiest week of Q1 reporting Earnings Scorecard,0.17475471,0.13580978,0.55362576,0.3105645
2024-05-06,Even Worse than Gamestop 3 Meme Stocks That Are Screaming Sells,-0.94315916,0.95407987,0.034999363,0.010920708
2024-05-06,Time to Sell These 3 UnderPerforming Stocks Based on Their Bad Decisions,-0.1491229,0.21064115,0.7278406,0.06151826
2024-05-06,Baidu Stock Analysis Its Surprisingly Cheap to Bet on Chinas ChatGPT,0.2281642,0.017900325,0.7360352,0.24606451
2024-05-06,Stocks to Sell 3 Wall Street Darlings About to Become Investor Nightmares,0.12471003,0.065051876,0.74518627,0.1897619
2024-05-06,Warren Buffetts Berkshire Hathaway Cuts Stake In Apple,-0.48067164,0.52045137,0.43976888,0.039779723
2024-05-06,How the Medical Industry Could Produce the Biggest AI Stock Winners,0.082932465,0.014446904,0.8881737,0.09737937
2024-05-06,7 Stocks to Buy to Satisfy Your IRA Limits in 2024,0.06879102,0.015632197,0.8999446,0.084423214
2024-05-06,Thanks To Apple This Analyst Is Optimistic On ARM Microchip Technology And More Ahead Of Earnings,0.85587543,0.009182181,0.12576024,0.8650576
2024-05-06,Apple May Pursue Production Of Foldable Devices Next Year,0.1519443,0.008379889,0.8312959,0.16032419
2024-05-06,Apple Pencil Pro Spotted On Apples Japanese Website,0.028367579,0.027001917,0.9176286,0.055369496
2024-05-07,Apples Aggressive Buyback and Growth Prospects Fuel Bullish Stock Outlook,0.8387289,0.0655367,0.030197687,0.9042656
2024-05-07,Latest Apple event is on tap along with AI chip rumors,0.0075296275,0.0334105,0.9256494,0.04094013
2024-05-07,Apple Will Pursue Aggressive And No Holds Barred Strategy Around AI Says Bullish Analyst Worst Is In Rearview Mirror,0.8365462,0.021111835,0.12123018,0.857658
2024-05-07,3 Sinking Stocks to Quickly Abandon Now,-0.49215943,0.54151493,0.40912956,0.049355492
2024-05-07,Caution Why SoundHound AI Stock May Be All Bark and No Bite,-0.050419092,0.07786177,0.8946955,0.027442679
2024-05-07,New Sell Rating for Apple AAPL the Technology Giant,0.33862653,0.009427998,0.6425175,0.34805453
2024-05-07,Loop Capital Markets downgrades Apple AAPL to a Hold,-0.37755767,0.42848173,0.52059424,0.05092405
2024-05-07,Analysts Offer Insights on Technology Companies Apple AAPL and Infineon Technologies AG OtherIFNNF,0.05128479,0.013346491,0.9220222,0.06463128
2024-05-07,RIVN Stock Alert Is Rivian About to Partner With Apple,0.07550025,0.010472096,0.9035556,0.08597235
2024-05-07,Apple unveils new iPad Air iPad Pro AIfocused M4 chip,0.11353978,0.012321199,0.86181784,0.12586097
2024-05-07,Apple Working On Its Own AI Chip For Data Centers WSJ,0.14280927,0.009405204,0.83838034,0.15221448
2024-05-07,3 Nasdaq Darlings With Hidden Upside Potential,-0.23225294,0.36044914,0.5113547,0.1281962
2024-05-07,Strong Earnings Just Another Reason to Buy AI Stocks,0.24281313,0.016888628,0.72340965,0.25970176
2024-05-07,Apple Introduces M4 Chip AIInfused Logic Pro,0.13336542,0.0106545035,0.8453256,0.14401993
2024-05-07,Apple Unveils IPad Pro And IPad Air,0.10063598,0.0113830855,0.8765978,0.11201907
2024-05-07,Cirrus Logic climbs as quarterly EPS nearly doubles expectations,0.8423826,0.06601288,0.025591664,0.90839547
2024-05-07,New Apple M4 Chip Threatens to Dethrone Nvidia NVDA Stock,-0.82954454,0.8454579,0.13862868,0.015913349
2024-05-07,Apples Strategic Moves Impresses Analyst as Buffett Adjusts Stake,0.7562472,0.028544562,0.1866636,0.78479177
2024-05-08,Apples iPad Pro and iPad Air Innovations Bolster Buy Rating,0.93700624,0.012361655,0.0382704,0.9493679
2024-05-08,Analysts Conflicted on These Technology Names Apple AAPL Intel INTC and Datadog DDOG,-0.4699152,0.5030892,0.46373686,0.033173975
2024-05-08,Analysts Opinions Are Mixed on These Technology Stocks Datadog DDOG Marqeta MQ and Apple AAPL,-0.6046706,0.6347903,0.33508995,0.0301197
2024-05-08,Which Credit Bureau Stock Should You Buy for the LongTerm,0.005869884,0.025097543,0.94393504,0.030967427
2024-05-08,Alphabet Stock Alert Why Investors Should Stay away from GOOG for Now,-0.026554063,0.110928334,0.8046974,0.08437427
2024-05-08,PayPal Stock Analysis Why PYPL Is Still a Huge Bargain Right Now,-0.029064294,0.06766207,0.8937402,0.038597774
2024-05-08,Tim Cook Kicked Off iPad Event By Hyping Up Apple Vision Pro Top Analyst Says Its Just A Reminder While Jim Cramer Says Its Not A Bust,-0.007076226,0.064529836,0.8780166,0.05745361
2024-05-08,3 Tech Stock Darlings to Scoop Up After Q2 earnings,0.49347734,0.08702808,0.33246654,0.58050543
2024-05-08,Analysts Offer Insights on Technology Companies Apple AAPL Flywire FLYW and Squarespace SQSP,0.039899416,0.01560678,0.92888707,0.055506196
2024-05-08,Prominent Apple Bull Reveals Surprise Takeaway From Apples iPad Launch Tim Cooks AI Ambitions Now Lot FasterWith Announcement Of M4 Chip,0.47916198,0.09592019,0.32899767,0.5750822
2024-05-08,Cirrus Logic soars as it crushes expectations in challenging market,-0.62458366,0.77881736,0.066949025,0.15423368
2024-05-08,Apples New M4 iPads More Powerful Than Any AI PC Today Set To Boost Sales,0.90915114,0.009996862,0.07085513,0.919148
2024-05-08,UBS Keeps Their Hold Rating on Apple AAPL,0.032627374,0.0287776,0.90981746,0.061404973
2024-05-08,Buy Rating Affirmed for Apple Amid Strong iPad Growth and AI Advancements,0.93314195,0.018441338,0.02997548,0.95158327
2024-05-08,The 3 Best Metaverse Stocks to Buy in May 2024,0.06263505,0.014149526,0.90906584,0.07678457
2024-05-08,Apples Crush IPad Pro Ad Sparks Outrage,0.06837055,0.049315967,0.8329975,0.11768652
2024-05-09,The 3 Best Warren Buffett Stocks to Buy in May 2024,0.035157923,0.018936176,0.92696977,0.0540941
2024-05-09,The 3 Most Undervalued Under20 Stocks to Buy in May 2024,0.113271095,0.06260472,0.76151943,0.17587581
2024-05-09,The 3 Best ETFs to Buy in May 2024,0.07160098,0.011806115,0.9047868,0.0834071
2024-05-09,3 Promising Robotaxi Stocks to Snap Up Before August 8,0.5524199,0.12516603,0.19724804,0.67758596
2024-05-09,Unity Software dips following mixed Q1 2024 results as new CEO prepares to step in,-0.95761585,0.9684479,0.020720063,0.010832044
2024-05-10,Apple Analyst Says Rumors Of InHouse AI Chip Another Breadcrumb Ahead Of WWDC Cupertino Ready To Play ChessWhile Others Playing Checkers,0.118171535,0.057702534,0.76642334,0.17587407
2024-05-10,Semiconductor Superstars 3 Chip Stocks Powering the Tech Boom in 2024,0.2921796,0.012650893,0.6825186,0.30483052
2024-05-10,The 3 Best Auto Stocks to Buy in May 2024,0.08179209,0.014902583,0.88840276,0.09669467
2024-05-10,AMC Networks slips as Q1 results miss expectations,-0.95567995,0.96778977,0.02010045,0.012109815
2024-05-10,Taiwan Semiconductor spurs chip gains amid AIrelated surge in sales,0.90534645,0.031297743,0.032058068,0.9366442
2024-05-10,EarningsProof Tech Plays 3 Stocks Set to Stay Hot Beyond Reporting Season,0.60700065,0.06355245,0.26589444,0.6705531
2024-05-10,The 3 Best BlueChip Stocks to Buy in May 2024,0.11757403,0.011036001,0.860354,0.12861003
2024-05-10,Apple Issues Apology For Controversial Crush Ad Following Wide Criticism,-0.8493411,0.88177365,0.08579375,0.032432567
2024-05-10,Apple To Use M2 Chips To Power AI Servers Bloomberg,0.13502398,0.00872646,0.8475231,0.14375044
2024-05-10,Stocks Surge On Healthy Earnings Season Rising Jobless Claims This Week In The Markets,0.35362044,0.30772254,0.030934492,0.661343
2024-05-10,AI Revolution On the Doorstep The Tidal Wave Is Well Underway Analyst Says,0.3149038,0.09266685,0.49976254,0.40757063
2024-05-11,The 3 Best Mutual Funds to Buy in May 2024,0.107597865,0.009869692,0.87266266,0.11746756
2024-05-12,GOOG Stock Analysis Unlocking the Future Potential of Alphabet in 2024,0.24790978,0.009041555,0.7340071,0.25695133
2024-05-12,Why Microsoft Stock Is the Pick of the Magnificent Seven Litter,0.024873307,0.024229338,0.926668,0.049102645
2024-05-12,AAPL Analysis Why Apple Stock Dipped in Q2 and Whats Ahead for Q3,-0.7260693,0.7517147,0.22263981,0.025645427
2024-05-13,Analysts Conflicted on These Technology Names DigitalOcean Holdings DOCN Micron MU and Apple AAPL,-0.33937842,0.37972873,0.5799209,0.040350314
2024-05-13,Biggest Upgrade In Siris 13Year History Top Analyst Strikes Bullish Note On Apple Inching Closer To Powering Its Virtual Assistant With OpenAIs ChatGPT,0.9184301,0.017395627,0.04677859,0.9358257
2024-05-13,The 3 Most Undervalued Software Stocks to Buy in May 2024,0.073851496,0.06705712,0.7920343,0.14090861
2024-05-13,Apples Potential Partnership With OpenAI Opens Up Revenue Opportunities Says Tech Bull The Golden Goose For Cook And Cupertino Was,0.8681359,0.0073974864,0.11706917,0.8755334
2024-05-13,Apple Music To Unveil Its 100 Best Albums,0.09322162,0.013923269,0.8789318,0.107144885
2024-05-13,Apple Store Strike Workers in Towson Maryland Authorize First Strike,-0.42744938,0.45826304,0.5109233,0.030813677
2024-05-13,Now Even Apple Wants to Make Data Center Chips Which Are the 3 Best Chipmaker Stocks to Buy,0.243026,0.009566317,0.7378413,0.25259233
2024-05-13,Apple Reportedly In Talks With OpenAI To Integrate ChatGPT Into IOS 18 Bloomberg,0.29671746,0.008690956,0.68590057,0.30540842
2024-05-14,As Roaring Kitty Returns Here Are 3 ETFs To Leverage The 2024 Meme Stock Wave,0.15242459,0.008729787,0.83011585,0.16115437
2024-05-14,Googles Search Business Could Be Challenged By OpenAI Says Gene Munster Its A Function Of Time,-0.17973945,0.23370619,0.712327,0.05396674
2024-05-14,Apple AAPL Gets a Hold from KeyBanc,-0.006506242,0.073544405,0.85941744,0.06703816
2024-05-14,Foxconn Q1 profit surges 72 boosted by demand for AI servers but misses estimates,0.82403696,0.07511698,0.025729064,0.89915395
2024-05-14,Apple Stock Alert Warning AAPLs Problems Are Getting Worse,-0.9462947,0.9604663,0.025362149,0.014171614
2024-05-14,Alphabet Stock Outlook Pounce on GOOG if Theres an Open AIDriven SellOff,-0.8703666,0.8830028,0.104360856,0.012636254
2024-05-14,Analysts Are Bullish on Top Technology Stocks 3D Systems DDD GoDaddy GDDY,0.14129533,0.05071047,0.75728375,0.1920058
2024-05-14,Stick a Fork in It and Run Intel Stock Is Done,-0.006180916,0.039825663,0.9265296,0.033644747
2024-05-14,Metaverse Moguls 3 Stocks Poised to Dominate the Virtual Realm,0.13491476,0.021891989,0.8213012,0.15680674
2024-05-14,Apple Addiction 3 Fund Managers Doubling Down on AAPL Stock,-0.9436839,0.9530682,0.03754752,0.009384274
2024-05-14,3 Retail Stocks Most at Risk of the New Cautious Consumer Trend,-0.8404935,0.86461383,0.11126587,0.024120342
2024-05-14,New Hotter Inflation Data Momo Buys The Dip Fed Blunder Shows Up In Roaring Meme Stocks,0.04212059,0.07363258,0.8106143,0.115753174
2024-05-14,Stable Stocks 3 Blue Chips to Buy for Longterm Profits,0.095294,0.018677333,0.8673513,0.11397133
2024-05-14,Buy Rating on Apple Affirmed by Analyst Erik Woodring Amid Strong Google Deal and App Store Resilience,0.91895455,0.028264625,0.024516162,0.9472192
2024-05-14,AI On iOS To Drive Higher Institutional Ownership Of Apples iPhone Analyst Sees 235 Upside,0.83065903,0.0087767085,0.15178756,0.83943576
2024-05-14,3 Cryptos to Turn 100000 Into 1 Million Spring 2024,0.14095056,0.010413419,0.83822256,0.15136398
2024-05-14,Google IO 2024 To Spotlight AI Innovations And New Monetization Opportunities Analyst Says,0.6011708,0.009182279,0.38046467,0.61035305
2024-05-14,Warren Buffets Blunders 3 Investments Even the Oracle Regrets,-0.26044786,0.31829253,0.6238628,0.057844672
2024-05-14,Apple Releases IOS 175 With New Features,0.11960858,0.01243192,0.8555276,0.1320405
2024-05-15,Banking on Experience 3 Financial Stock Picks from Wall Streets LongestServing Guru,0.23711571,0.038638387,0.6856075,0.2757541
2024-05-15,Apple Introduces New Accessibility Features In Upcoming Software,0.41396618,0.009350856,0.567332,0.42331704
2024-05-15,Berkshire Hathaway Stock Alert Warren Buffett Could Reveal His Mystery Buy Today,-0.0038559996,0.039395988,0.925064,0.03553999
2024-05-15,Bridgewaters top Q1 buys sells Amazon AMD Medtronic CME others,0.047268365,0.013283938,0.9261638,0.060552303
2024-05-15,ATT goes up against Elon Musks Starlink with AST SpaceMobile deal,0.887004,0.011534893,0.0899262,0.8985389
2024-05-15,3 LowRisk HighReward Stocks to Buy to Protect Your Portfolio From a Market Crash,0.022215601,0.030004572,0.9177753,0.052220173
2024-05-15,Berkshire Hathaways top buyssells in Q1 includes new 67B Chubb stake,0.07023387,0.016530897,0.8967043,0.08676477
2024-05-15,Google Advances AI Integration While Apple May Partner with OpenAI to Enhance Siri Analysts Say,0.8914918,0.008271847,0.09196456,0.89976364
2024-05-15,Chubb stock surges after Berkshire Hathaway discloses 67B stake,-0.11819121,0.48258322,0.15302476,0.364392
2024-05-16,Buffetts BillionDollar Biz 3 Crucial Takeaways From Berkshires Q1 Results,0.0739157,0.059722178,0.80663997,0.13363788
2024-05-16,3 Warren Buffett Stocks That Look Irresistible Right Now,0.060672525,0.031895008,0.8755374,0.09256753
2024-05-16,7 Cheap Russell 2000 Stocks to Buy Now May 2024,0.074111745,0.017701933,0.8904844,0.091813676
2024-05-16,Shiny Apple 3 Reasons to Buy and Hold AAPL Stock Forever,0.043431245,0.012428446,0.93171185,0.05585969
2024-05-16,7 NoBrainer Stocks to Buy and Hold for the Next 20 Years May 2024,0.020526962,0.018896176,0.94168067,0.039423138
2024-05-16,Warren Buffett Is Making a 67 BILLION Bet on Chubb CB Stock,0.02063111,0.022644138,0.9340806,0.04327525
2024-05-16,Coatue Management top Q1 moves exits Apple Disney takes in Qualcomm piles into TSMC,0.027590308,0.034471124,0.9034675,0.062061433
2024-05-16,Snowflake Analysts Remain Overweight Potential Growth Despite Iceberg Adoption Concerns,-0.59585893,0.75275964,0.09033966,0.15690069
2024-05-16,Samsung Ridicules Apples Crushing IPad Commercial,-0.85099864,0.8668851,0.11722846,0.015886506
2024-05-16,M4 IPad Pro Performs Well In Durability Test Better That Previous Models,0.9317478,0.022004629,0.024242945,0.9537524
2024-05-16,Brace for a Market Crash With These 3 Surprising New Inflation Hedges,-0.3170635,0.4131223,0.49081895,0.096058786
2024-05-17,Rally Rockets 3 Stocks Benefitting From the Markets Unstoppable Surge,0.88240945,0.014915194,0.0877602,0.8973246
2024-05-17,Dow 40000 What Does Hitting the Major Milestone Mean for Investors,0.015507974,0.03247158,0.9195489,0.047979552
2024-05-17,EXCLUSIVE GameStop AMC Buzz May Prove To Be ShortLived CEO Of Company Behind MEME ETF Tells Benzinga,0.048119884,0.045666847,0.8605464,0.09378673
2024-05-17,Thousands Of Apple Users Report IMessage Outage,-0.9514807,0.9589689,0.033542983,0.0074882084
2024-05-18,nan,0.042532753,0.037080552,0.8833061,0.079613306
2024-05-19,The name Magnificent 7 needs to be retired Goldman,-0.09087719,0.11073164,0.8694139,0.019854447
2024-05-20,Apple AAPL Receives a Hold from UBS,0.13408023,0.012807402,0.840305,0.14688763
2024-05-20,Why Taiwan Semiconductor Stock Is an Unstoppable Juggernaut to Bet On,0.0173003,0.03158059,0.91953856,0.04888089
2024-05-20,Buffetts Best Bets 3 MustHave Stocks in the Oracles Arsenal,0.05565324,0.035959926,0.8724269,0.091613166
2024-05-20,Jabil withdraws 2025 guidance after removing CEO Kenneth Wilson,-0.8761982,0.886926,0.102346115,0.010727824
2024-05-20,Microsoft reveals AIready PCs new Surface models launch of Recall,0.24712351,0.0113894995,0.73009753,0.258513
2024-05-20,Is WisdomTree US LargeCap Dividend ETF a Strong ETF Right Now,0.90931976,0.010484466,0.06971133,0.9198042
2024-05-20,Should You Invest in the Technology Select Sector SPDR ETF,0.05455008,0.010494815,0.9244603,0.065044895
2024-05-20,Should ALPS Be on Your Investing Radar,0.072276995,0.033018027,0.86168694,0.105295025
2024-05-20,Ride Out the Turbulence 3 EV Stocks to Own for Massive Wealth Creation,0.076955855,0.016893398,0.8892573,0.09384926
2024-05-21,MSFT Alert Buy Microsoft Stock Before the Next Move Higher,0.0123538505,0.018651018,0.95034415,0.031004868
2024-05-21,Intel Stock is an AI Play You Can Skip Out On,-0.071920685,0.102883935,0.86615276,0.030963251
2024-05-21,Worldwide Takeover 3 Stocks Poised for Global Domination,0.099683896,0.04567833,0.8089594,0.14536223
2024-05-21,Renaissance Of Growth Coming Back To Apple Says Tech Bull Ahead Of WWDC Next Week Key Moment For Cupertino,0.72723436,0.01955718,0.2336513,0.74679154
2024-05-21,3 Sectors That Will Suffer Most From the Biden China Tariffs,-0.91095525,0.92488146,0.061192308,0.013926224
2024-05-21,Retire in Style 3 Stocks to Buy Now for a Plush Future,0.050616853,0.01700312,0.9153769,0.06761997
2024-05-21,3 Metaverse Stocks to Buy on the Dip May 2024,0.15677457,0.021366997,0.8004914,0.17814156
2024-05-21,3 Reasons Not to Waste Your Time on Apple Stock This Year,0.0040157624,0.032898348,0.9301875,0.03691411
2024-05-21,3 ETFs to Buy Now May 2024,0.04388373,0.014277991,0.9275603,0.05816172
2024-05-21,3 Stocks That Could Be the Next Apple Amazon or Google by 2034,0.03920192,0.013904608,0.9329888,0.053106528
2024-05-22,Analysts Offer Insights on Technology Companies Apple AAPL and FDM Group Holdings GBFDM,0.053591136,0.014145571,0.9181177,0.06773671
2024-05-22,Weird But Wonderful 3 Altcoins With 10X Potential This Year,0.29363284,0.012414914,0.6815374,0.30604774
2024-05-22,Hear a pin drop Nvidia Q1 results guidance has Wall Street on edge,-0.120158106,0.4431294,0.23389927,0.32297128
2024-05-22,Monumental Funding Has Elon Musk AI Venture Primed For Takeoff,0.7367227,0.0075784414,0.24812049,0.74430114
2024-05-22,3 Inexpensive Stocks That Could Deliver JawDropping Returns,0.20223789,0.010589585,0.7765829,0.21282747
2024-05-22,3 Chip Stocks to Buy to Invest in AIs Brain,0.06933437,0.011062939,0.9085397,0.08039731
2024-05-23,Betting on Nvidia 3 ETFs to Own for Exposure to the AI Giant,0.0007747449,0.03323915,0.932747,0.034013893
