date,cleaned_title,compound,neg,neu,pos
2023-10-23,SP 500 Breaches 200Day Average As Treasury Yields Hit 5 Analyst Says The Primary Trend Is Down,-0.09741196,0.4607702,0.17587163,0.36335823
2023-10-23,The Magnificent 7 Stocks Are a PreEarnings Buy Despite the Tesla Miss,0.19401456,0.029559707,0.74686605,0.22357427
2023-10-23,Taylor Swift Concert Film Smashes More Records Heres Where The Movie Ranks For All Films In 2023,0.018179,0.037226245,0.9073685,0.055405244
2023-10-24,CashRich Apple Still Needs Billions To Catch Up In Generative AI Race Against Meta Or Microsoft Analyst MingChi Kuo Reveals Why,0.11124165,0.030730754,0.82729685,0.14197241
2023-10-24,Buffetts Bullish Bets 3 Stocks Where Warren Has At Least a 25 Stake,-0.12176835,0.20207767,0.717613,0.080309324
2023-10-24,Its Not Just Lithium Tesla Rivian And The Green Revolution Rely On These Precious Metals,0.025062697,0.018001748,0.9389338,0.043064445
2023-10-24,Despite 3 Increase In Spot Price Of Gold GLD Loses Close To A Billion In AUM ETF Winners And Losers LargeCap Flows,-0.89508563,0.9312153,0.032654952,0.03612968
2023-10-24,Concern Grows Over Chinese Economy This Foreign Market Fund That Excludes China Grows Nearly 7 ETF Winners And Losers MidCap Flows,0.514896,0.2086597,0.06778465,0.7235557
2023-10-24,US stocks rise on strong earnings while bond yields stabilize,0.68724906,0.11750481,0.07774132,0.8047539
2023-10-24,Hey Warren 3 Stocks Buffett Should Buy Now,0.082913294,0.014997446,0.8870918,0.09791074
2023-10-24,Buying In Stocks On Pullback In Yields Rush To Buy Bitcoin,0.09351081,0.40621504,0.09405913,0.49972585
2023-10-24,3 AI Stocks to Buy Now to Turn 5000 Into 15000,0.111564234,0.013865333,0.8607051,0.12542957
2023-10-24,Apple set to report earnings next week Heres what Wall Street expects,0.030837405,0.02456322,0.92003614,0.055400625
2023-10-24,This Bank May Be the First TrillionDollar Financial Stock,0.027901392,0.025784414,0.9205297,0.053685807
2023-10-24,If You Invested 1000 In Bitcoin When The First Bitcoin ETF Was Filed Heres How Much Youd Have Today And Did You Beat Tesla Apple,0.11110977,0.013070407,0.8627494,0.124180175
2023-10-24,QCOM Stock Looks Appealing as Qualcomm Cuts Costs,0.9084601,0.009932388,0.07167509,0.9183925
2023-10-25,3 Dividend Stocks to Buy for Dependable Dividend Growth,0.06431372,0.013701319,0.90828365,0.07801504
2023-10-25,Why Are Fintech Stocks Down Today,-0.91704214,0.9282247,0.06059284,0.011182525
2023-10-25,Apple NASDAQAAPL This Magnificent Seven Stock is Too Unloved,-0.23379108,0.2617239,0.7103433,0.027932828
2023-10-25,Morgan Stanley Says Spotify The Business Has Joined Spotify The Product In Delivering For Shareholders,0.54688543,0.007890621,0.43733335,0.5547761
2023-10-26,NVDA Stock Analysis Why It May Be Time to Sell Nvidia Now,0.021620076,0.022068687,0.93424255,0.043688763
2023-10-26,Apple AAPL Receives a Rating Update from a Top Analyst,0.08134956,0.014643287,0.8893639,0.09599285
2023-10-26,Analysts Offer Insights on Technology Companies ServiceNow NOW Meta Platforms META and Apple AAPL,0.04953808,0.014201787,0.9220583,0.063739866
2023-10-26,Analysts Conflicted on These Technology Names Alight ALIT Apple AAPL and Paypal Holdings PYPL,-0.44561303,0.47753787,0.49053732,0.031924848
2023-10-26,Sizzling Q3 GDP Defies Recession Forecasts But Interest Rate Hike Warnings Are Dragging US Stock Performance,-0.90215164,0.9261534,0.049844824,0.024001773
2023-10-27,The Magnificent 7 Stocks for October 4 to Buy and 3 to Skip,0.020056818,0.01837742,0.94318837,0.038434237
2023-10-27,7 Stocks Set to Soar in a YearEnd Santa Claus Rally,0.67913735,0.028996382,0.26286992,0.70813376
2023-10-27,Amazon AMZN Stock Leads Magnificent Seven Higher After Earnings,0.5814345,0.0703441,0.2778773,0.6517786
2023-10-27,US Stocks Waver Tech Outperforms As September Inflation Data Solidifies Interest Rate Hold Oil Giants Fall Whats Driving Markets Friday,-0.7904196,0.86798733,0.054444835,0.07756778
2023-10-27,Masimo Might See Potential Royalty Windfall From ITCs Exclusion Order On Apple Watch Analyst,-0.77488047,0.79584265,0.18319517,0.02096218
2023-10-27,Bears Roam Wall Street As Middle East Conflict Earnings Outlook Raise Concerns Despite Strong Q3 US Economic Growth This Week In Markets,-0.4505012,0.69516695,0.060167294,0.24466574
2023-10-28,Investment Chief Proposes Adding Warren Buffetts Berkshire Hathaway To Magnificent Seven,0.020560276,0.020602714,0.93823427,0.04116299
2023-10-28,3 Tech Stocks to Load Up on Immediately,0.4406245,0.019275239,0.52082497,0.45989975
2023-10-29,nan,0.042532753,0.037080552,0.8833061,0.079613306
2023-10-30,Apple AAPL was upgraded to a Hold Rating at KeyBanc,0.82723296,0.007990096,0.15678687,0.8352231
2023-10-30,Apple Stock Might Not Be Ripe For Plucking As Analyst Predicts Revenue Drop To Continue Into Holiday Quarter,-0.95307606,0.9675313,0.018013379,0.014455258
2023-10-30,Apple AAPL New Buy Recommendation for This Technology Giant,0.55960447,0.009096478,0.42220256,0.56870097
2023-10-30,Why Are Stocks Up Today,-0.14328621,0.23660219,0.67008185,0.093315974
2023-10-30,Wall Streets Favorite AI Stock Is About to Plummet,-0.8749412,0.8976623,0.07961658,0.022721117
2023-10-30,Apple Will Post Earnings Thursday Heres What Goldman Sachs Expects,0.16091526,0.02136485,0.796355,0.18228011
2023-10-30,The 3 Best Warren Buffett Stocks to Buy Now November Edition,0.06447858,0.027206628,0.88110816,0.09168521
2023-10-30,Your Guide to HighYielding ETFs Top 3 Picks in the 5174 Range,0.16220887,0.01264201,0.81250715,0.17485088
2023-10-30,3 ETFs Setting the Gold Standard for Investor Returns,0.3244192,0.010019329,0.65554214,0.33443853
2023-10-30,ITOT ETF An Ideal Building Block for New Investors,0.5868683,0.008151077,0.3968296,0.59501934
2023-10-31,Apple Unveils Three M3 Chips New MacBook Pros And IMacs,0.21902768,0.01255536,0.7558616,0.23158304
2023-10-31,Analysts Offer Insights on Technology Companies Apple AAPL and Pinterest PINS,0.05423182,0.014305074,0.917158,0.06853689
2023-10-31,Wall Street Analysts Are Bullish on Top Technology Picks,0.45144185,0.06742219,0.41371378,0.51886404
2023-10-31,Analysts Conflicted on These Technology Names ON Semiconductor ON Adyen OtherADYYF and Apple AAPL,-0.25335884,0.28775907,0.6778407,0.03440022
2023-10-31,Apple AAPL New Buy Recommendation for This Technology Giant,0.55960447,0.009096478,0.42220256,0.56870097
2023-10-31,Analysts Offer Insights on Technology Companies ON Semiconductor ON Wolfspeed WOLF and Apple AAPL,0.025431102,0.020623004,0.93332285,0.046054106
2023-10-31,Buy Rating for Apple Implications of the M3 Chip Innovation and Strategic Pricing on Future Performance,0.22935364,0.010909069,0.7488283,0.2402627
2023-10-31,Hold Rating on Apple Sacconaghis Analysis on M3 Release and Future Revenue Possibilities,0.06999054,0.010938254,0.90813303,0.080928795
2023-10-31,Analysts Opinions Are Mixed on These Technology Stocks ZoomInfo Technologies ZI Caci International CACI and Apple AAPL,-0.27195048,0.3031031,0.66574425,0.031152599
2023-10-31,Nvidia Forecast Why NVDA Is MustHave Stock for LongTerm Investors,-0.016837057,0.051104408,0.9146282,0.03426735
2023-10-31,Apple Incs Strategic Product Launches and Innovation Drive Positive Growth Outlook A Buy Recommendation,0.9223011,0.011916908,0.05386515,0.93421805
2023-10-31,3 Undervalued Stocks With Potential to Hit TrillionDollar Milestone,-0.86652267,0.9210343,0.024454113,0.05451162
2023-10-31,UBS Sticks to Its Hold Rating for Apple AAPL,0.17597681,0.018597178,0.7868288,0.194574
2023-10-31,Treasury Announcement More Important Than Feds Japan Abandons Yield Control Tesla Under 200,-0.0051119253,0.07905827,0.84699535,0.07394634
2023-10-31,New Chips May Not Lift AAPL Stock But Apples Services Biz Is Booming,0.5528375,0.02223787,0.40268674,0.5750754
2023-10-31,3 Top Dividend Stocks to Buy for LongTerm Growth,0.054737475,0.0155212395,0.91422004,0.070258714
2023-10-31,3 Stocks to Watch for Breakthrough Innovations in 2024,0.6073532,0.013572561,0.36550167,0.6209258
2023-10-31,Apple Unveils M3 Chips Analysts Expect It To Propel MacBook and iMac Performance and User Transition from Intel,0.92366785,0.01214268,0.052046806,0.9358105
2023-11-01,PINS META or SNAP Which Social Media Stock is a Strong Buy,0.13513036,0.015536233,0.83379716,0.1506666
2023-11-01,Will Apples NASDAQAAPL Hardware Sales Disappoint in Q4,-0.88416445,0.91355777,0.057048906,0.02939334
2023-11-01,The 7 Best Cathie Wood Stocks to Buy Now November Edition,0.075631745,0.019412765,0.8855427,0.09504451
2023-11-01,Stocks to Sell Now Before Momentum Reverses AAPL NVDA and TSLA,0.08070654,0.047311414,0.8246706,0.12801795
2023-11-01,Apple is about to announce earnings heres what Wall Street expects,0.046784863,0.022011124,0.90919286,0.06879599
2023-11-01,Should You Buy These 2 Magnificent Seven Stocks Ahead of Earnings Apple and Nvidia in Focus,0.029944487,0.014188147,0.9416792,0.044132635
2023-11-01,The Wealth Builders Toolkit Top 3 Stocks to Supercharge Your Portfolio,0.09098138,0.013250213,0.8825182,0.10423159
2023-11-01,Apple Q4 Earnings Preview All Eyes On iPhone 15,-0.05324135,0.08294415,0.88735306,0.029702796
2023-11-02,OKTA Stocks SellOff Presents an Opportunity,0.16479024,0.06479396,0.7056219,0.2295842
2023-11-02,Apple Inc AAPL Stock Forecast Prospects Brighten with M3 Chips and Robust FQ4 Expectations A LongTerm Buy Recommendation,0.9015566,0.030410541,0.03762239,0.93196714
2023-11-02,Apples New Global Play iPhone 17 Production To Start In India Not China Says Top Analyst,0.16480032,0.00930217,0.8165954,0.17410249
2023-11-02,HUBC Stock Alert What to Know as HUB Cyber Security Appoints New CFO,-0.008059833,0.03924807,0.9295637,0.031188238
2023-11-02,Why Are Stocks Up Today,-0.14328621,0.23660219,0.67008185,0.093315974
2023-11-02,US stocks jump as bond yields plunge on bets that the Fed has finished hiking,-0.77177614,0.8318204,0.108135305,0.060044277
2023-11-02,Apple Gears Up For Q4 Print These Most Accurate Analysts Revise Forecasts Ahead Of Earnings Call,1.8265098e-05,0.03934035,0.921301,0.039358616
2023-11-02,Apple Stock All Eyes on Earnings Heres What JP Morgan Expects,-0.013973571,0.047736116,0.9185013,0.033762544
2023-11-02,PayPal Stock Dont Get Shaken Out of This Valuetastic Trade,-0.010313332,0.073579185,0.863155,0.06326585
2023-11-02,PayPal Stock NASDAQPYPL Stand by a Fundamentally Sound Payments Giant,0.65912837,0.010984798,0.31890208,0.67011315
2023-11-02,Wall Street Predicts These 3 Warren Buffett Stocks Will Soar 88 to 242,0.9099974,0.019205935,0.05159071,0.92920333
2023-11-02,Green Wave Boosts Stocks Bonds As Traders Embrace Feds Stance Await Apple Earnings Whats Driving Markets Thursday,0.0738692,0.35215476,0.22182123,0.42602396
2023-11-02,Goldman Sachs Weighs in on Apple Stock Following Scary Fast Event,-0.23860838,0.35729492,0.5240186,0.11868654
2023-11-02,Trading Strategies For Apple Stock Heading Into Q4 Earnings,0.002917679,0.02970667,0.937669,0.03262435
2023-11-02,Qorvos Strategic Wins with Apple and Chinas Android Stability Still Analysts Lower Price Targets After Q2,0.7423354,0.11526475,0.027135089,0.85760015
2023-11-02,Apple Inc Announces Increase In Q3 Income Beats estimates,0.8556302,0.053542387,0.037285127,0.9091726
2023-11-02,Beyond the Apple Hype An AAPL Stock Reality Check,0.07276504,0.01914106,0.88895285,0.09190609
2023-11-03,Its Game On for These 3 Strong Buy Gaming Stocks,0.07637132,0.013229364,0.89716995,0.08960068
2023-11-03,Meet the Next TrillionDollar Companies Our Top 3 Picks,0.20878738,0.009403717,0.7724052,0.2181911
2023-11-03,Apple NASDAQAAPL Stock Dont Fret Over Holiday Outlook Says Analyst,-0.4597807,0.5336028,0.3925751,0.07382208
2023-11-03,Apple AAPL New Buy Recommendation for This Technology Giant,0.55960447,0.009096478,0.42220256,0.56870097
2023-11-03,Apple Skyworks Solutions And 3 Stocks To Watch Heading Into Friday,0.049715225,0.019389417,0.9115059,0.06910464
2023-11-03,Analysts Offer Insights on Technology Companies Apple AAPL and Coinbase Global COIN,0.058260113,0.012627467,0.91648495,0.07088758
2023-11-03,Resilient iPhone Sales and Strong Services Growth Drive Buy Rating for Apple Inc An Analysis by Aaron Rakers of Wells Fargo,0.4014086,0.013295151,0.57200104,0.41470376
2023-11-03,Hold Rating on Apples Stock Amid Balanced Growth and Uncertainty An Analysis,0.043450594,0.026761793,0.90302587,0.07021239
2023-11-03,Deutsche Bank Recommends Buy for Apple Citing Services Sector Growth and Strength in Greater China,0.9227847,0.019534169,0.03814699,0.94231886
2023-11-03,Apples Solid Financial Performance and Ecosystem Strategy Justify Buy Rating An Analysis of Michael Walkleys Recommendation,0.24744761,0.008221358,0.7361097,0.25566897
2023-11-03,Promising Future for Apple Despite Challenges A Buy Rating Analysis,0.92887837,0.013164838,0.044792026,0.9420432
2023-11-03,Hold Rating for Apple Amidst Declining Projections and Geopolitical Risks Despite Potential Growth Opportunities,-0.8945207,0.9391268,0.016267218,0.04460607
2023-11-03,Analysts Offer Insights on Technology Companies Apple AAPL and Trainline OtherTNLIF,0.049685627,0.01449146,0.92133147,0.06417709
2023-11-03,Apple Coinbase Global Fortinet And Other Big Stocks Moving Lower In Fridays PreMarket Session,-0.9456705,0.9577306,0.030209286,0.012060109
2023-11-03,Analysts Offer Insights on Technology Companies Apple AAPL Shopify SHOP and Motorola Solutions MSI,0.042300012,0.015451615,0.92679673,0.057751626
2023-11-03,7 Evergreen Stocks for Longterm Wealth Generation,0.018589359,0.024266563,0.9328775,0.042855922
2023-11-03,Why Apple Shares Are Sliding Over 2 Premarket Today,-0.8954886,0.9093542,0.07678023,0.013865591
2023-11-03,Analysts Have Conflicting Sentiments on These Technology Companies Expedia EXPE Qualys QLYS and Apple AAPL,-0.8797246,0.8966578,0.08640898,0.016933203
2023-11-03,7 Apple Analysts Size Up Q4 Earnings iPhone Strength China Fears Overblown Buy On The Dip Like Buffett,-0.24320415,0.5755856,0.092032954,0.33238146
2023-11-03,The 3 Best Tech Stocks to Buy in November,0.12721938,0.018649489,0.8354816,0.14586887
2023-11-03,Crude Oil Falls 2 Apple Posts Upbeat Earnings,-0.009516716,0.45410225,0.101312205,0.44458553
2023-11-04,Meta Platforms Stock NASDAQMETA Theres More Room to Run,0.12695527,0.012508811,0.8480271,0.13946408
2023-11-04,AAPL and GOOGLs PostEarnings Slump Time to Buy,0.0003055893,0.035705235,0.928284,0.036010824
2023-11-05,Top SmallCap Picks 3 Unstoppable Russell 2000 Stocks to Buy in November,0.15761541,0.0115059735,0.81937265,0.16912138
2023-11-06,7 Tech Stocks to Buy and Hold for the Next 25 Years,0.074541256,0.012415915,0.9006269,0.08695717
2023-11-06,Apples Stock Outlook Buy Rating Based on Service Sector Growth and Resilient iPhone Demand,0.7273496,0.00815943,0.25633147,0.73550904
2023-11-06,Buy Rating for Apple Driven by Services Revenue Growth and Geographical Profitability,0.8881813,0.009277876,0.09326292,0.8974592
2023-11-06,Charlie Munger Calls It Overhyped but Buffett Owns Billions Warrens 3 Big AI Stock Bets,-0.0011727102,0.034601428,0.9319698,0.033428717
2023-11-06,Stocks Fight To Extend Winning Streak Treasury Yields Rise Whats Driving Markets Monday,-0.5520163,0.72865015,0.094716035,0.17663385
2023-11-07,AAPL LI or ET Which Large Cap Stock is the Most Attractive Pick,0.09773402,0.008848573,0.88456887,0.10658259
2023-11-07,7 BlueChip Stocks With Share Buyback Programs,0.09585878,0.017654765,0.8688317,0.113513544
2023-11-07,AAPL Stock Outlook There Are Still Plenty of Reasons to Take a Bite of Apple,0.05959087,0.027378926,0.8856513,0.08696979
2023-11-07,3 Dependable AI Stocks to Buy for 2024,0.045020428,0.01757348,0.91983265,0.06259391
2023-11-07,Predicting the 7 Top Performing Stocks for 2024 With AI Technology,0.26800674,0.031283394,0.6694265,0.29929012
2023-11-07,Bollinger Bands What Are They And Do They Work,-0.029820792,0.05338264,0.92305547,0.023561846
2023-11-07,3 Publicly Traded Companies That Are Ripe for a Spinoff,0.0077826306,0.03707499,0.91806746,0.04485762
2023-11-08,Foreign Equity Funds See Big Movements ETF Winners And Losers MidCap Flows,0.43251202,0.15931472,0.24885848,0.59182674
2023-11-08,Analysts Have Conflicting Sentiments on These Technology Companies Apple AAPL Array Technologies ARRY and Expensify EXFY,-0.8970168,0.91396266,0.06909144,0.016945863
2023-11-08,3 Russell 2000 Stocks That Are Growing Faster Than the SP 500,0.6322787,0.010801352,0.3461186,0.64308006
2023-11-09,Meta Platforms Stock NASDAQMETA Analysts Remain Bullish About Further Upside,-0.6602662,0.7508491,0.158568,0.09058291
2023-11-09,AAPL Stock Should You Buy the Apple Dip,0.041102976,0.0172289,0.9244392,0.058331873
2023-11-09,Morgan Stanley Says Buy Apple Stock as It Becomes a True AI Enabler,0.09679149,0.0108375205,0.88153344,0.10762901
2023-11-09,3 Tech Stocks to Buy in the Green Zone,0.1495125,0.011497297,0.8274929,0.1610098
2023-11-09,AI Could Supercharge These 2 Companies,-0.8565179,0.87341326,0.109691285,0.016895354
2023-11-09,Arm Holdings Stock NASDAQARM Too Much Hype Too Little Results,0.017721426,0.034588158,0.9131022,0.052309584
2023-11-09,3 Quantum Computing Stocks to Make You the Millionaire Next Door,0.078959785,0.0131339505,0.89477235,0.092093736
2023-11-10,Apple Agrees To Pay 25 Mln To Settle Employment Discrimination Allegations,0.31019568,0.25952816,0.170748,0.56972384
2023-11-10,The 7 Next Trillion Dollar Companies to Invest in to Become a Millionaire,0.12543969,0.0095486725,0.85546297,0.13498837
2023-11-10,Nvidia Qualcomm Jumping Into CPU Arms Race Can They Succeed,0.096652284,0.01925164,0.86484444,0.11590393
2023-11-10,3 RecessionResistant Stocks to Create a MultiAsset Portfolio,0.20327245,0.007950861,0.78082585,0.2112233
2023-11-10,Tech Giants Lead Market Surge As Dow Blue Chips Stall Microsoft Hits New Highs While Bitcoin Rallies The Week In The Markets,0.80599093,0.044957995,0.10409311,0.8509489
2023-11-11,PYPL Outlook Can Paypal Become an AI Stock,-0.65431815,0.67608523,0.3021477,0.02176708
2023-11-11,The 3 Priciest Magnificent Seven Stocks Worth the Splurge,0.035117283,0.023214513,0.91845375,0.0583318
2023-11-12,The iPhone For AI Betting Big On Artificial Intelligence,0.107605636,0.014991433,0.86241156,0.12259707
2023-11-12,How to Invest in Artificial Intelligence 3 Stocks to Buy,0.071742594,0.013999748,0.90025795,0.08574234
2023-11-12,Resilient US Sales and Stable Supply Chain Drive Buy Recommendation for Apple Stock,0.93495035,0.015993387,0.03306296,0.9509437
2023-11-13,Apple NASDAQAAPL Stock An UndertheRadar AI Play,-0.13068774,0.19888224,0.73292327,0.06819449
2023-11-13,Apple Stock The Good and Bad News for AAPL Investors,0.0069145635,0.041939795,0.90920585,0.04885436
2023-11-13,DebtFueled Buybacks 3 Stocks Undeterred by Rising Rates,0.35342723,0.26913685,0.1082991,0.6225641
2023-11-13,Apples Taiwanese Suppliers Are Outperforming Seasonal Sales Does It Hint at Resilient Demand This Analyst Answers,-0.035558134,0.4882762,0.059005633,0.45271808
2023-11-14,The 3 Best Robinhood Stocks for Beginning Investors,0.11183603,0.01694968,0.85426456,0.12878571
2023-11-14,Apples Stock Performance Evaluating Factors Behind Improved Gross Margins and Future Predictions,0.5029487,0.16495158,0.16714813,0.66790026
2023-11-14,7 Cryptos that Could Skyrocket Next,-0.3886298,0.41790822,0.5528133,0.029278431
2023-11-14,Qualcomm Stock NASDAQQCOM Are Good Days Ahead for the Chipmaker,0.54419553,0.013198184,0.42940804,0.5573937
2023-11-14,ABNB Stock Alert Airbnb Just Made a 200 Million Bet on AI,0.07488546,0.016959652,0.89119524,0.09184511
2023-11-14,3 Top Tech Stocks Outside the Magnificent Seven,0.06778777,0.061183717,0.8098448,0.12897149
2023-11-14,Despite Apple Pays Impact PayPals Growth Prospects Remain Strong Analyst,0.9401486,0.015097769,0.02965576,0.9552464
2023-11-14,6 TopRated AI Stocks for Your November MustBuy List,0.0077043604,0.029868348,0.9325589,0.037572708
2023-11-14,3 Meme Stocks That Are Here for the Long Haul,0.050312705,0.017227309,0.91523266,0.06754001
2023-11-15,QCOM Stock Sell Alert 3 Reasons Why Longterm Investors Should Dump Qualcomm,-0.10385992,0.15192083,0.80001825,0.048060913
2023-11-15,GOOG Stock What the Antitrust Trial Means and Doesnt Mean for the Tech Giant,-0.004852187,0.040110637,0.9246309,0.03525845
2023-11-15,AAPL Stock Is the Magic Gone Heres How You Can Still Profit,0.07853048,0.026643597,0.86818224,0.10517408
2023-11-15,Stocks Inch Higher On Soft PPI Magnificent 7 Retest 2021 Record Highs Whats Driving Markets Wednesday,0.51602817,0.19572872,0.09251437,0.7117569
2023-11-15,Chips Ahoy 3 Semiconductor Stocks You Need to Buy Now,0.075245686,0.014872399,0.8950095,0.09011809
2023-11-16,Apples Stock Buy Rating Reinforced RecordBreaking Sales Ecosystem Expansion and Innovative Product Launches Driving Shareholder Value,0.9325659,0.014044127,0.039345954,0.94661003
2023-11-16,3 MustBuy Stocks on Every Market Dip,-0.114559196,0.16040733,0.7937445,0.04584814
2023-11-16,Why Intel Is a Chip Stock Worth Buying,0.057948776,0.017440012,0.90717113,0.07538879
2023-11-16,Goldman Sachs 2024 Equity Outlook Winning Stocks And Sectors To Watch,0.009668741,0.03156878,0.9271937,0.041237522
2023-11-17,3 LargeCap Tech Stocks to Toss Now,0.10009688,0.071084976,0.75773317,0.17118186
2023-11-17,Premier Stocks To Own As AI Quickly Reshapes Our Future,0.19215074,0.011838699,0.7841719,0.20398945
2023-11-17,3 Reasons to Buy AAPL Stock Even After Its Fourth Consecutive Sales Decline,0.2685632,0.013695191,0.7040464,0.2822584
2023-11-17,Can TSLA Stock 2X Your Money Heres How High It Can Climb,0.103038535,0.0113326395,0.8742962,0.11437117
2023-11-18,2023 Winners 7 Stocks That Will Continue to Dominate in 2024,0.29567903,0.012686745,0.67894745,0.3083658
2023-11-19,Apple Gets a New StreetHigh Price Target,0.24635212,0.015143801,0.7233603,0.26149592
2023-11-19,The 3 Hottest ETFs to Buy Right Now,0.047894448,0.01741284,0.9172799,0.06530729
2023-11-19,Analyst Recommends Buy Rating for Apple Stock Amid Robust iPhone 15 Series Performance and Balanced Supply Chain,0.9314645,0.019510053,0.029515453,0.9509745
2023-11-20,Penn Entertainment PENN Stock Gains on Analyst Upgrade,0.7102081,0.115259685,0.059272557,0.8254678
2023-11-21,Next in Line 7 Undervalued Alternatives to the Magnificent 7 Stocks,0.8309678,0.014553951,0.13992429,0.84552175
2023-11-21,No Holiday Cheer For Apple Analyst Details These 2 Factors That Can Pressure Cupertinos Hardware Revenue In Q1,-0.45663914,0.48982674,0.47698566,0.03318761
2023-11-21,Analysts Offer Insights on Technology Companies Zoom Video Communications ZM Apple AAPL and MKS Instruments MKSI,0.052873652,0.0142094,0.9187075,0.06708305
2023-11-21,Analysts Offer Insights on Technology Companies Zoom Video Communications ZM and Apple AAPL,0.03708502,0.018396633,0.9261218,0.055481654
2023-11-21,Upward Revision of Apples Earnings Amid Googles Legal Battle A Buy Rating Recommendation,-0.8122937,0.89140636,0.029481018,0.079112664
2023-11-21,The Next Tech Battlefield Apples Position in the Emerging AI Landscape,0.38221404,0.009222323,0.59934133,0.39143637
2023-11-21,7 Tech Stocks to Load Up On Ahead of Lower Borrowing Costs,0.857702,0.041969363,0.05835917,0.8996714
2023-11-21,3 Elite DividendPaying Stocks to Hold for Eons,0.08058272,0.045481086,0.8284551,0.12606381
2023-11-21,From Energy to Retail The Next 3 TrillionDollar Stocks,0.04647044,0.013884275,0.925761,0.060354717
2023-11-22,Apple NASDAQAAPL Boring But Commands Massive Pricing Power,0.3166083,0.015873192,0.6516453,0.3324815
2023-11-22,Jim Cramer Agrees With Bank Of Americas Prediction For SP 500 To Hit 5K By 2024 But Other Than Sentiment Being Way Too Negative,0.35065204,0.07475259,0.49984282,0.42540464
2023-11-22,Take My Money 3 Stocks to Buy Hand Over Fist,0.034912065,0.02066106,0.9237658,0.055573124
2023-11-22,Short Seller Hedge Funds Rack Up 43B Loss In Recent Market Rally,-0.9429054,0.961614,0.019677427,0.018708613
2023-11-22,Wall Street On AI Less Talk More Action Tech Titans Strategies Unveiled,0.03960012,0.021219647,0.9179605,0.060819767
2023-11-23,Apple Stock NASDAQAAPL Can Siri Keep Up in the ChatGPT Age,0.372698,0.027940625,0.5714207,0.40063864
2023-11-23,Why a Bet on Disney Stock Is a Bet on Bob Iger,-0.034494296,0.063715346,0.90706366,0.02922105
2023-11-23,Will Apples NASDAQAAPL iPhone Sales Tick Higher in Q4,0.93186927,0.016118713,0.03589333,0.947988
2023-11-23,Key AI Debates For 2024 Nvidia Competitors Threaten Semiconductor Giants Dominance With Custom Chips,-0.6960668,0.73630875,0.22344927,0.04024196
2023-11-23,The 3 Top Semiconductor Stocks Powering the Tech Boom,0.16329747,0.013242835,0.8102169,0.17654032
2023-11-24,7 Stocks Set to Capitalize on the Coming YearEnd Rally,0.8690608,0.015863797,0.0992117,0.8849246
2023-11-24,Apples iPhone 15 Thrives Despite Huawei Competition Analyst Predicts Continued Success Into 2024,0.93446606,0.015574898,0.03438414,0.95004094
2023-11-25,AAPL AMZN or NVDA Which Strong Buy MegaCap Tech Stock Could Deliver the Best Returns,0.4907868,0.0076903254,0.49383262,0.4984771
2023-11-26,3 Mighty Mixed Reality Stocks Blending Digital and Physical Worlds,0.04343672,0.015141282,0.9262807,0.058578003
2023-11-27,3 Compelling Cloud Storage Stocks to Send Your Portfolio Higher,0.0560188,0.014630317,0.9147206,0.07064912
2023-11-27,TimeTested Titans 7 Stocks to Anchor Your Portfolio for 10 Years,0.14510868,0.012542424,0.82980645,0.15765111
2023-11-27,Apples Growth Stalemate 3 Reasons to Start Diversifying Away From AAPL Stock,0.35050976,0.01822141,0.6130474,0.36873117
2023-11-27,Apple Stock Golden Opportunity at Play Says Dan Ives,0.6263034,0.015147999,0.3434007,0.64145136
2023-11-27,3 Music Streaming Stocks Set to Hit the Right Notes in 2024,0.6761041,0.012224792,0.29944628,0.6883289
2023-11-27,AI Stock Predictions 7 Names Google Bard Believes Will Double in 2024,0.6260742,0.019666303,0.33459318,0.6457405
2023-11-28,Analysts Offer Insights on Technology Companies Zscaler ZS and Apple AAPL,0.040812373,0.016816124,0.92555535,0.057628497
