date,cleaned_title,compound,neg,neu,pos
2023-07-19,T Rowes Blue Chip Growth ETF TCHP Plenty to Like but Alternatives Abound,0.11197662,0.032376647,0.82327014,0.14435327
2023-07-19,Bank of America Securities Sticks to Their Hold Rating for Apple AAPL,0.07003585,0.034141973,0.86168015,0.104177825
2023-07-19,Smart Take 3 Reasons Why Apple Should Buy Disney,0.0069228318,0.028800381,0.9354764,0.035723213
2023-07-19,Analyst Draws Parallel Between Nvidia And Apple Believes Investors Can Still Ride The Wave Despite 200 Surge This Year,0.92135996,0.0185048,0.041630358,0.93986475
2023-07-19,Why the Bull Market Rally Will Last Until 2025 At Least,-0.004841976,0.04001315,0.92481565,0.035171174
2023-07-19,Investors Heavily Search Apple Inc AAPL Here is What You Need to Know,0.0059784707,0.026894452,0.94023263,0.032872923
2023-07-19,SPY and QQQ ETFs are Buzzing on Reddit Is There More Upside Left,-0.10259125,0.15014447,0.8023023,0.047553223
2023-07-19,Market Clubhouse Morning Memo July 19th 2023 Trade Strategy For SPY QQQ AAPL TSLA NFLX NVDA And MSFT,0.019544456,0.018435977,0.94358355,0.037980434
2023-07-19,Apple Analyst Expects Stock To Hit 210 On 2024 Earnings Projections iPhone Delay,0.8581931,0.040332127,0.061142597,0.89852524
2023-07-19,3 Alternative BlueChip Stocks to Add to Your Buy List,0.053492766,0.013422873,0.9196615,0.06691564
2023-07-20,New Buy Rating for Apple AAPL the Technology Giant,0.445163,0.010950155,0.5329367,0.45611316
2023-07-20,META Could Hit the Jackpot or Lose It All in the HighStakes AI Game,-0.021058239,0.080538735,0.8599807,0.059480496
2023-07-20,Why the Worry Warts Are Wrong About Apple Stock,-0.07606259,0.110017,0.8560286,0.033954415
2023-07-20,7 Tech Stocks That Could Form the Next Magnificent Seven,0.04988153,0.014532256,0.921054,0.064413786
2023-07-20,Ross Gerber Says Tesla Is Like Apple 15 Years Ago But Better,0.032189406,0.018985417,0.9298398,0.051174823
2023-07-20,Taiwan Semiconductor tumbles on weak Q2 delay to Arizona plant,-0.92232645,0.95373756,0.014851272,0.031411126
2023-07-20,If youre getting mocked for loving Apple Maps heres your reminder that people once thought the iPhone was stupid too,-0.31831896,0.36802417,0.5822707,0.049705222
2023-07-20,MSFT Stock Alert Nancy Pelosi Has Made 125 MILLION on Microsoft in 2023,0.057986334,0.014589989,0.91283363,0.07257632
2023-07-20,3 Growth Stocks to Buy to Turn 10000 Into 1 Million,0.13070674,0.009757639,0.849778,0.14046438
2023-07-20,Chips sink as Taiwan Semiconductor 2023 outlook sends shivers across sector,-0.8480934,0.88327205,0.081549205,0.03517869
2023-07-20,NFLX TSLA Earnings Our 10 Major Takeaways,0.06996879,0.01972451,0.89058214,0.0896933
2023-07-20,25 MillionaireMaker AI Stocks to Buy Now,0.1439148,0.015355632,0.82537395,0.15927044
2023-07-20,Market Clubhouse Morning Memo July 20th 2023 Trade Strategy For SPY QQQ AAPL MSFT TSLA And NVDA,0.011694033,0.022323225,0.9436595,0.034017257
2023-07-20,Disney Stock NYSEDIS Looks Deeply Undervalued as Shares Take Yet Another Hit,-0.8625069,0.91988057,0.022745766,0.057373624
2023-07-21,Google Microsoft among 7 firms pledging AI safeguards says White House,0.15100262,0.021826731,0.8053439,0.17282934
2023-07-21,TSMC Delays Start Of Chip Production In Arizona Plant,-0.67710555,0.69905907,0.27898738,0.021953534
2023-07-21,Market Clubhouse Morning Memo July 21st 2023 Trade Strategy For SPY QQQ AAPL MSFT GOOGL And NVDA,0.014337949,0.022038743,0.9415846,0.036376692
2023-07-21,Potential Delay In iPhone 15 Debut Could Impact Apples Margins Metas Threads App Faces User Exodus Microsoft CEO Satya Nadellas Earnings Exceed 1B Todays Top Stories,-0.82022405,0.8431848,0.13385448,0.022960797
2023-07-21,The 3 Most Undervalued Retirement Stocks to Buy Now July 2023,0.048873857,0.032597676,0.88593084,0.08147153
2023-07-21,WINN ETF Can You Really Win with This ETF,0.23689544,0.0109895,0.7411256,0.24788494
2023-07-22,Warren Buffetts Apple Bet Makes Berkshire Hathaway Stock Juicier Again Analyst Spots 15 Discount,0.07353546,0.12970826,0.66704804,0.20324372
2023-07-22,Benzinga Bulls And Bears AMC Apple Philip Morris Ford And Elon Musks Demon Mode,0.00023568422,0.040030837,0.91970265,0.04026652
2023-07-23,The 3 Best Value AI Stocks to Buy Right Now,0.039420005,0.019694239,0.9211916,0.059114244
2023-07-24,Apple To Rally Over 17 Here Are 10 Other Analyst Forecasts For Monday,0.05025288,0.054902036,0.83994305,0.10515492
2023-07-24,Are You Ready for a Small Cap Surge,0.06564514,0.033741374,0.86687213,0.09938652
2023-07-24,5 Moonshot AI Stocks to Buy Immediately,0.07452685,0.026671344,0.8721305,0.10119819
2023-07-24,SPOT Stock Falls 5 as Spotify Hikes Prices,-0.94872886,0.96654004,0.015648754,0.01781119
2023-07-24,Nasdaq100 Rebalancing Takes Effect What That Means for Magnificent Seven Stocks,0.026996288,0.018373083,0.93625754,0.04536937
2023-07-24,If You Can Only Buy One Stock It Better Be One of These 3 Names,0.0014949366,0.027955938,0.94259316,0.029450875
2023-07-24,Why Apple Stock Just Got a PriceTarget Hike,-0.10202457,0.16196074,0.7781031,0.05993617
2023-07-24,Microsoft Apple And Coinbase Among 7 LongTerm Stock Investment Favorites Of Benzinga Users,0.08282755,0.012552844,0.8920668,0.095380396
2023-07-25,Taiwan Semiconductor Stock NYSETSM Great Value after Its Q2 Dip,0.9080361,0.019295856,0.05337213,0.927332
2023-07-25,3 MillionaireMaker Autonomous Driving Stocks to Buy Before the Window Closes,0.25420788,0.03859788,0.6685963,0.29280576
2023-07-25,Apple AAPL New Buy Recommendation for This Technology Giant,0.55960447,0.009096478,0.42220256,0.56870097
2023-07-25,Apple Is One of the Best Stocks to Buy and Hold Right Now,0.14187615,0.009852667,0.83841854,0.15172881
2023-07-25,Market Clubhouse Morning Memo July 25th 2023 Trade Strategy For SPY QQQ MSFT GOOGL AAPL And NVDA,0.012999801,0.022101121,0.94279796,0.035100922
2023-07-25,Apple Stock The Catalyst That Could Send Shares Higher,0.02301991,0.27597666,0.42502677,0.29899657
2023-07-25,3 Stocks to Buy Before They Become Future Dividend Aristocrats,0.023339845,0.018643238,0.9393737,0.041983083
2023-07-25,Ark Funds On Nasdaq Rebalancing Can Smaller Tech Stocks Have Their Spotlight Plus A Look At Top 10 Holdings And Weightings,0.12188036,0.011375388,0.8553689,0.13325575
2023-07-25,Goldman Sachs Says Apple Is Primed For Q3 Earnings Beat Fueled By 2 Business Lines,0.9103448,0.017204566,0.055246055,0.92754936
2023-07-25,If You Can Only Buy 1 LongTerm Stock It Better Be One of These Names,-0.005918378,0.034836624,0.9362451,0.028918246
2023-07-26,Analysts Offer Insights on Technology Companies Microsoft MSFT Apple AAPL and Spotify Technology SA SPOT,0.06549954,0.011962486,0.91057545,0.077462025
2023-07-26,META Earnings Today Is Another Solid Beat in Store,0.9259892,0.018048918,0.037912987,0.94403815
2023-07-26,Will Apple Stock End the Year Above 200 Per Share,0.22931007,0.034412764,0.7018644,0.26372284
2023-07-26,GOOGL MSFT Earnings A Tale of Two Tech Titans,0.0065343753,0.047002874,0.89945996,0.05353725
2023-07-26,Market Clubhouse Morning Memo July 26th 2023 Trade Strategy For SPY QQQ AAPL MSFT GOOGL And NVDA,0.014924491,0.022399565,0.9402764,0.037324056
2023-07-26,3 ETFs to Buy and Hold for the Next 5 Years,0.036243357,0.0123688355,0.939019,0.048612192
2023-07-26,3 MillionaireMaker Metaverse Stocks to Buy Before the Window Closes,0.060678437,0.015226364,0.9088689,0.0759048
2023-07-26,Machine Learning Megatrends 3 AI Stocks Set to Dominate,0.1501241,0.02775658,0.7943627,0.17788067
2023-07-27,VTI ETFs Simple but Powerful Strategy is a LongTerm Winner,0.07941875,0.014067785,0.89244574,0.09348653
2023-07-27,7 Monster Stocks to Buy Right Now,0.028817615,0.027543666,0.916095,0.05636128
2023-07-27,3 Tech Stocks You Better Be Buying on Each and Every Dip,0.049562432,0.014200412,0.9220367,0.06376284
2023-07-27,Apple AAPL Receives a Hold from Bernstein,0.13230555,0.013671796,0.8403509,0.14597735
2023-07-27,Analysts Offer Insights on Technology Companies RELX plc OtherRLXXF Apple AAPL and Bilibili BILI,0.05634866,0.0150200045,0.9136113,0.071368665
2023-07-27,Incredible Meta Earnings Confirm the Big Tech Bull Thesis,0.84091294,0.024585383,0.10991631,0.8654983
2023-07-27,Market Clubhouse Morning Memo July 27th 2023 Trade Strategy For SPY QQQ AAPL MSFT TSLA And NVDA,0.013336351,0.022001242,0.94266117,0.035337593
2023-07-27,Strong Economic Data Dow Winning Steak Similar To Famous PreCrash Streaks Of The Past,0.76996,0.031128014,0.16778395,0.801088
2023-07-27,If You Can Only Buy One Penny Stock It Better Be One of These 3 Names,-0.0024295785,0.033402532,0.9356245,0.030972954
2023-07-27,7 Semiconductor Stocks to Buy Before the Breakout,0.07278742,0.043825846,0.8395609,0.11661327
2023-07-28,My Apple Stock Price Prediction for 2025,0.0039864816,0.029321939,0.93736964,0.03330842
2023-07-28,Incoming Stock Pullback Reveals An Attractive Buying Opportunity,0.9170454,0.02146086,0.040032867,0.93850625
2023-07-28,SetandForget Picks The 3 Best Defensive Stocks for the Next Decade,0.088422045,0.014618055,0.8823419,0.1030401
2023-07-28,Market Clubhouse Morning Memo July 28th 2023 Trade Strategy For SPY QQQ AAPL MSFT TSLA And NVDA,0.01275022,0.021852646,0.9435445,0.034602866
2023-07-28,Aggressive Momo Buying On BOJ Action Bearish Technical Pattern Consumers Splurge,-0.8871597,0.9123908,0.062378075,0.025231132
2023-07-28,Catalyst Watch Amazon earnings jobs report and will Apple talk AI,-0.020083636,0.05147277,0.9171381,0.031389132
2023-07-28,Is Apple Headed For A BlueSky Run The iStock Trades In These Bullish Patterns Following Fed Call On Rates,-0.08089663,0.29307792,0.49474084,0.21218129
2023-07-28,Four of the Magnificent Seven Report Earnings Heres What They Say About AI,-0.035688438,0.06331876,0.9090509,0.02763032
2023-07-28,Is QYLD ETFs 113 Dividend a HighYield Trap,0.2981325,0.023996426,0.6538747,0.32212892
2023-07-29,Apple Stock Earnings Beat Is in the Cards Says Goldman Sachs,0.083115235,0.042290736,0.8323032,0.12540597
2023-07-29,Benzinga Bulls And Bears Tesla Apple AMC Alibaba And Dogecoins Global Payment Role On Musks X Predicted,0.17378098,0.008648103,0.8089228,0.18242908
2023-07-30,7 Dow Stocks to Buy as Recession Fears Roll Back,-0.28538153,0.4251782,0.4350251,0.13979667
2023-07-31,New Buy Rating for Apple AAPL the Technology Giant,0.445163,0.010950155,0.5329367,0.45611316
2023-07-31,Analysts Offer Insights on Technology Companies Qualcomm QCOM and Apple AAPL,0.047917362,0.016183201,0.9197163,0.06410056
2023-07-31,Earnings season by the numbers Seven things to know,0.012686785,0.055588115,0.876137,0.0682749
2023-07-31,5 AI Stocks Poised for Growth Without SkyHigh Risk,0.3484088,0.0150163425,0.6215585,0.36342514
2023-07-31,Apple AAPL Receives a Buy from Monness,0.18552756,0.009883324,0.7947058,0.19541089
2023-07-31,Can Apple Satisfy Wall Street Top Analyst Says 2 Factors Key To Meeting JuneQuarter Expectations,0.116700865,0.013743663,0.8558118,0.13044453
2023-07-31,Apple To Rally Over 12 Here Are 10 Other Analyst Forecasts For Monday,0.05319547,0.054296702,0.8382112,0.10749217
2023-07-31,Earnings And Non Farm Payroll Week Has Arrived Prepare For The Busy Upcoming Week With MandoTrading,-0.048346937,0.12737484,0.7935973,0.079027906
2023-07-31,Trucking Firm Yellow Ceases Operations Walmart Buys Out Tiger Globals Stake Former Disney Executives Join As Advisers To CEO Bob Iger Todays Top Stories,0.043041304,0.021874217,0.9132103,0.06491552
2023-07-31,Market Clubhouse Morning Memo July 31st 2023 Trade Strategy For SPY QQQ AAPL MSFT And NVDA,0.011293987,0.022398936,0.94390815,0.033692922
2023-07-31,AI Frenzy Result Perma Bulls Revered And Perma Bears Reviled Apple And Amazon Earnings Ahead,-0.92734486,0.9409783,0.045388233,0.013633459
2023-07-31,US Stocks Take A Breather Nasdaq Notches Fifth Straight Month Of Gains Investors Gear Up For Pivotal Week,0.8065194,0.050410427,0.09265965,0.85692984
2023-07-31,Artificial Intelligence Is Being NameChecked By Tech More Than Ever This Earnings Season,0.053587075,0.03164358,0.8831257,0.085230656
2023-07-31,Apples iPhone Share in China Shows Positive Momentum India Emerges as Rapidly Growing Market Analyst Says Ahead Of Q3,0.9279401,0.02116819,0.029723605,0.94910824
2023-07-31,Apple Stock Countdown to Earnings Begins,0.28043368,0.23490873,0.24974886,0.5153424
2023-08-01,Apple AAPL Gets a Hold from UBS,-0.033613026,0.11170929,0.8101945,0.07809626
2023-08-01,7 Growth Stocks That Are Still Great Buys Even as Interest Rates Peak,0.57882804,0.02243226,0.37630743,0.6012603
2023-08-01,3 Strong Buy Cryptos You Should Be Loading Up On Now,0.16600032,0.012507284,0.8089851,0.17850761
2023-08-01,3 Stocks That Need to Follow Elon Musks Rebranding Moves,0.038720332,0.01553643,0.93020684,0.054256763
2023-08-01,Market Clubhouse Morning Memo August 1st 2023 Trade Strategy For SPY QQQ AAPL MSFT And AMZN,0.014715884,0.021876298,0.94153154,0.03659218
2023-08-01,Meet Reed Jobs the Apple cofounders son who just launched a VC fund to invest in cancer treatments,0.09987415,0.012700331,0.87472516,0.11257448
2023-08-01,SPOT TTWO HEAR 3 StrongBuyRated Entertainment Stocks Analysts Love,0.0020892099,0.07498627,0.84793824,0.07707548
2023-08-02,Stick to US stocks that offer experience over hope Goldman says,0.10025023,0.014949471,0.8698508,0.1151997
2023-08-02,Apple Q3 preview iPhone India and AI all in focus,0.036451392,0.019771436,0.9240057,0.05622283
2023-08-02,Stocks Hit Escape Velocity Blasting Into a New Bull Market,0.33646792,0.1318573,0.3998175,0.46832523
2023-08-02,Apple earnings heres what to expect,-0.005984118,0.033415634,0.93915284,0.027431516
2023-08-02,AMD leads chips lower on weak Q3 forecast investors await Qualcomm results,-0.95720255,0.9676732,0.021856206,0.010470648
2023-08-02,Market Clubhouse Morning Memo August 2nd 2023 Trade Strategy For SPY QQQ AAPL MSFT AMD And META,0.025515372,0.01688532,0.94071394,0.04240069
2023-08-02,US Credit Rating Downgraded Momo Crowd Aggressively Buys The Dip,-0.0820882,0.23866306,0.6047621,0.15657486
2023-08-02,Applec Card highyield savings account by Goldman hits 10B in deposits,0.8520403,0.04560239,0.05675503,0.8976427
2023-08-02,SPY QQQ And IWM The 3 Tickers To Short If The Market Declines After The Fitch Downgrade How Traders Can Profit From The Fitch Downgrade Of US Bonds,-0.10382542,0.30542928,0.49296686,0.20160386
2023-08-02,Apple Analysts Upbeat Ahead Of Tech Giants Q3 Print Why Earnings Could Be Positive Catalyst Driving Stock Higher,0.67443645,0.11654928,0.09246502,0.79098576
2023-08-03,AAPL Earnings Today Heres What to Expect from the iPhone Maker in Fiscal Q3,0.021515872,0.02188759,0.93470895,0.04340346
2023-08-03,Apple among BofA picks for options opportunity on earnings surprise,0.22095813,0.022664411,0.73371303,0.24362254
2023-08-03,Analysts Offer Insights on Technology Companies Match Group MTCH Apple AAPL and Qorvo QRVO,0.060548954,0.012756938,0.91393715,0.07330589
2023-08-03,Qualcomm stumbles as analysts question guidance structural uncertainties,-0.9543944,0.96693593,0.020522559,0.012541532
2023-08-03,Qorvo pops as Wall Street sees cyclical inflection after strong Q1 results guidance,-0.2979221,0.62943643,0.039049253,0.33151433
2023-08-03,Apple earnings Focus likely on margins services genAI Citi says,0.060430583,0.025099639,0.8893702,0.08553022
2023-08-03,Whats Going On With Apple Stock Ahead Of JuneQuarter Results,-0.15987876,0.18740778,0.78506327,0.027529009
2023-08-03,Apple is set to report earnings after the bell Heres what Wall Street expects,0.09147167,0.020438125,0.8676521,0.1119098
2023-08-03,Market Clubhouse Morning Memo August 3rd 2023 Trade Strategy For SPY QQQ AAPL AMZN MSFT And NVDA,0.020944314,0.01887068,0.9413143,0.039814994
2023-08-03,Investors Should Be Excited About This Stock Market Selloff,0.13349053,0.020296926,0.82591563,0.15378746
2023-08-03,American Express NYSEAXP An Interesting Value Stock to Watch on Weakness,0.14931765,0.009861916,0.83095855,0.15917957
2023-08-03,Apple Stock Price Outlook The Road to 400 and Beyond,0.19808307,0.019716326,0.76248425,0.2177994
2023-08-03,Why Is Qualcomm QCOM Stock Down 8 Today,-0.925847,0.9357526,0.054341912,0.009905583
2023-08-03,Can Qualcomm Overcome The Challenge Of Elevated Inventory 5 Analysts Deep Dive Into FQ3 Print Outlook,0.61806643,0.026664078,0.32860538,0.6447305
2023-08-03,Apple Q3 Preview Analyst Expects Modest Beat Downward Guide But Sees Improving Q4 App Store Trends,0.8224234,0.07777493,0.02202673,0.90019834
2023-08-03,Apple GAAP EPS of 126 beats by 007 revenue of 818B inline,0.08950274,0.032091502,0.8463143,0.12159424
2023-08-03,Crude Oil Rises 25 Kellogg Posts Upbeat Earnings,0.62541515,0.12405861,0.12646763,0.74947375
2023-08-03,Apple slips even as Q3 results top estimates aided by Services strength,-0.79145765,0.88250685,0.026443977,0.09104917
2023-08-03,Apple Inc Q3 Income Climbs Beats estimates,0.85523003,0.058475327,0.027819319,0.91370535
2023-08-04,Apple AAPL New Buy Recommendation for This Technology Giant,0.55960447,0.009096478,0.42220256,0.56870097
2023-08-04,Bernstein Reaffirms Their Hold Rating on Apple AAPL,0.057995,0.030204235,0.88159657,0.088199235
2023-08-04,Barclays Sticks to Its Hold Rating for Apple AAPL,0.11488322,0.020642186,0.84383243,0.1355254
2023-08-04,AAPL AMZN AMD Is There More Upside Left in These Buzzing Reddit Stocks,-0.013059273,0.057400394,0.8982585,0.04434112
2023-08-04,Amazon Owens Minor And 3 Stocks To Watch Heading Into Friday,-0.0057254583,0.07210278,0.8615199,0.06637732
2023-08-04,Apple Fortinet Microchip Technology And Other Big Stocks Moving Lower In Fridays PreMarket Session,-0.94949454,0.95991445,0.029665587,0.010419931
2023-08-04,4 stocks to watch on Friday Apple Block and more,-0.12531504,0.2703233,0.58466846,0.14500827
2023-08-04,Ralph Lauren To Rally 17 Here Are 10 Other Analyst Forecasts For Friday,-0.040997066,0.072756566,0.895484,0.0317595
2023-08-04,Wall Street Analysts Are Bullish on Top Technology Picks,0.45144185,0.06742219,0.41371378,0.51886404
2023-08-04,Market Clubhouse Morning Memo August 4th 2023 Trade Strategy For SPY QQQ AAPL And MSFT,0.019284923,0.019681837,0.94135135,0.03896676
2023-08-04,Apple AAPL Receives a Rating Update from a Top Analyst,0.08134956,0.014643287,0.8893639,0.09599285
2023-08-04,Nikolas Abrupt CEO Transition Carl Icahn Led Icahn Enterprises Cuts Dividend Payout FDA Rejects Mesoblasts Cell Therapy For Kids Todays Top Stories,-0.2641886,0.35919866,0.54579127,0.09501008
2023-08-04,Benzingas Top Ratings Upgrades Downgrades For August 4 2023,-0.67455953,0.6958641,0.28283137,0.021304544
2023-08-04,Apple On Track For The Worst Revenue Decline Streak In Two Decades And Interest Rates Rise Momo Crowd Does Not Care,-0.9308746,0.94445,0.041974515,0.013575413
2023-08-04,July Job Market Data Gives the Signal to Buy Everything,0.47952425,0.105785355,0.30890498,0.5853096
2023-08-04,Is Apple Stocks RiskReward Still Attractive After Q3 Earnings Lighter iPhone Revenues New Chapter Of How Investors View Apple,0.094818175,0.023242354,0.8586971,0.11806053
2023-08-04,Nasdaq Surges Over 100 Points Apple Shares Fall After Q3 Results,-0.95608926,0.96597713,0.024135048,0.009887846
2023-08-04,Why ResMed Shares Are Trading Lower By 15 Here Are Other Stocks Moving In Fridays MidDay Session,-0.757902,0.7755338,0.2068344,0.017631799
2023-08-04,Apple Stock NASDAQAAPL A Quiet Winner in the AI Race That Still Has Upside,0.63428617,0.036572248,0.29256934,0.6708584
2023-08-04,What to look for when Berkshire Hathaway reports Q2 earnings on Saturday,-0.023880374,0.044826735,0.9342269,0.020946361
2023-08-04,Did Apple and Amazon Report Magnificent Earnings,-0.2387385,0.27438906,0.68996036,0.035650555
2023-08-04,EXCLUSIVE Top 10 MostSearched Tickers On Benzinga Pro In July See Where Tesla Carvana Rivian Nikola And More Rank,0.028854389,0.018161323,0.934823,0.04701571
2023-08-05,Apple AAPL New Buy Recommendation for This Technology Giant,0.55960447,0.009096478,0.42220256,0.56870097
2023-08-05,New Buy Rating for Apple AAPL the Technology Giant,0.445163,0.010950155,0.5329367,0.45611316
2023-08-05,Berkshire Hathaway Q2 operating earnings drive up on strong insurance results,0.9046837,0.036970098,0.021376057,0.9416538
2023-08-06,JEPI Fans Take Note Theres a New 10 Dividend Yield Competitor in Town,0.14209169,0.027036352,0.8038356,0.16912805
2023-08-06,3 Things Elon Musk Can Do at Twitter to Keep METAs Threads at Bay,0.034979254,0.019923337,0.92517406,0.05490259
2023-08-06,3 Cheap Metaverse Stocks That Smart Investors Will Snap Up Now,0.071672484,0.016138501,0.8960505,0.087810986
2023-08-06,7 Top Stocks Billionaires Are Loading Up On,0.11691624,0.04246548,0.79815274,0.15938172
2023-08-06,Stocks most loved and shunned by hedge funds,-0.47555622,0.50268376,0.4701887,0.027127538
2023-08-07,AAPL Stocks Pullback A Golden Opportunity for Longterm Apple Investors,0.8734831,0.010946017,0.104624875,0.88442916
2023-08-07,Apple AAPL Receives a Hold from Loop Capital Markets,0.15693684,0.009758898,0.82354534,0.16669574
2023-08-07,Buy Amazon Stock but Avoid Apple for Now Says Analyst,-0.004449846,0.034908243,0.9346333,0.030458396
2023-08-07,Nvidia Just Confirmed an Emerging AI Boom in Biotech,0.804827,0.014256301,0.1666604,0.8190833
2023-08-07,Three stocks make the cut for Credit Suisses Top of the Crop list,-0.062383577,0.28033426,0.50171506,0.21795069
2023-08-07,PayPal Unveils USDBacked Stablecoin Trucking Firm Yellow Corp Files For Bankruptcy FDA Approves First Oral Treatment For Postpartum Depression Todays Top Stories,0.11483213,0.07831393,0.72854,0.19314606
2023-08-07,Largest Ever Chinese Russian Warship Group Approached Alaska Earnings Drop Meme Stocks Resurgent,0.122535884,0.41228545,0.052893147,0.53482133
2023-08-07,Dear AAPL Stock Fans Mark Your Calendars for Sept 22,-0.0123393815,0.036954593,0.9384302,0.024615211
2023-08-08,Bank of America Securities Reaffirms Their Hold Rating on Apple AAPL,0.13525158,0.01620841,0.8323316,0.15145999
2023-08-08,META AMZN or AAPL Which FAANG Stock is the Best Pick,0.0778681,0.009819569,0.90249276,0.087687664
2023-08-08,The Years Top 3 Tech ETFs as of August 2023,0.105821036,0.020112447,0.8539541,0.12593348
2023-08-08,Market Clubhouse Morning Memo August 8th 2023 Trade Strategy For SPY QQQ AAPL MSFT NVDA And TSLA,0.023026481,0.018008817,0.94095594,0.0410353
2023-08-08,Phillip Securities Keeps Their Hold Rating on Apple AAPL,0.022768036,0.032665767,0.9119004,0.055433802
2023-08-08,Winning Big in the Cutthroat AI Wars,0.82766634,0.023817873,0.12469785,0.85148424
2023-08-08,The Years Top 3 Sector ETFs as of August 2023,0.040039994,0.026992211,0.9059756,0.0670322
2023-08-08,The 7 Best Warren Buffett Stocks to Buy for August 2023,0.0290949,0.019910445,0.9310842,0.049005345
2023-08-08,The Years Top 3 Growth ETFs as of August 2023,0.16548693,0.015698977,0.8031151,0.1811859
2023-08-08,Find the Next Nvidia 3 MustWatch AI Stocks,-0.00016981363,0.031786464,0.93659693,0.03161665
2023-08-08,Skyworks Solutions Analysts Prefer Qorvo Due To More Pronounced Content Gains In iPhone Robust Presence In China,0.88534796,0.011313949,0.092024095,0.89666194
2023-08-08,AppLovin Analyst Maintains Bearish View on Stock Ahead Of Q2 Amid Concerns Over Apples Impact,-0.93752587,0.95796144,0.021602992,0.020435544
2023-08-09,Market Clubhouse Morning Memo August 9th 2023 Trade Strategy For SPY QQQ AAPL MSFT And TSLA,0.018289935,0.020299204,0.9411116,0.03858914
2023-08-09,Dogs of the Dow Decade EditionMore Pains Or Gains Ahead,0.07723579,0.3186133,0.28553766,0.39584908
2023-08-09,3 Stocks to Avoid If This Bull Market Turns Bearish,-0.18257959,0.20722039,0.7681389,0.024640795
2023-08-09,What Are the Best Stocks to Invest in for the LongTerm Our 3 Picks for August,0.042339843,0.014500223,0.9286597,0.056840066
2023-08-09,CPI Inflation Data Hits Thursday 5 ETFs With Potential For Wild Market Moves,-0.22482625,0.47859737,0.2676314,0.25377113
2023-08-09,Disney earnings call More streaming price hikes amid pivot toward profits,0.1797775,0.38969052,0.04084148,0.569468
2023-08-09,3 NotSoObvious Stocks to Benefit From Bidens Broadband Plan,0.6406244,0.007230885,0.3449139,0.6478553
2023-08-09,AAPL AMZN Which Stock is a Better PostEarnings Buy,0.16344106,0.016710278,0.80313843,0.18015134
2023-08-09,3 Growth Stocks to Sell in August Before They Crash and Burn,-0.07192825,0.11260712,0.84671396,0.040678874
2023-08-09,The 3 Best Retirement Stocks to Buy in August,0.092090584,0.018055072,0.8717993,0.11014566
2023-08-10,7 Tech Stocks to Hop On After RedHot Earnings,0.43318763,0.05796508,0.45088217,0.4911527
2023-08-10,3 Cloud Computing Stocks Youll Regret Not Buying Soon,0.004669044,0.036123388,0.9230842,0.04079243
2023-08-10,Biden issues order restricting certain US tech investments in China UK mulls,-0.35706082,0.39701378,0.5630332,0.039952952
2023-08-10,AppLovin surges as BofA says multiyear growth story is happening,0.901033,0.030698251,0.03757051,0.9317312
2023-08-10,TipRanks AllStar Analyst Who is the Best on AAPL Stock,0.15594354,0.012612912,0.81883067,0.16855645
2023-08-10,See Reason For Owning Disney Analysts Assess DTC Growth And PENN Sports Betting Deal,0.10781968,0.009730203,0.8727199,0.11754988
2023-08-10,July CPI Data Bullish or Bearish for Stocks,-0.6293255,0.735302,0.15872161,0.10597647
2023-08-10,AppLovin Faces Mixed Analyst Sentiments AXON 20s Promising Growth Amidst Apples Potential Challenge,0.90702695,0.03352512,0.025922898,0.94055206
2023-08-11,Analysts Offer Insights on Technology Companies Nio NIO CrowdStrike Holdings CRWD and Apple AAPL,0.036673255,0.016795456,0.9297358,0.05346871
2023-08-11,Uber Crowded Battleground and Sweet 16 stock portfolios from Jefferies,0.13164611,0.01342415,0.8415056,0.14507025
2023-08-11,Microsoft Faces Scrutiny Amid Government Email Breach WeWork Is The Latest Meme Stock ChatGPTs Popularity Surges Despite Restrictions By Tech Giants Todays Top Stories,0.41753048,0.26144302,0.05958351,0.6789735
